{
  "event_id": "469018e6-e910-4100-84cf-d84bf27ad9a6",
  "schema_version": 1,
  "timestamp": 1781848800000,
  "type": "chat_message",
  "server_sequence": 14,
  "payload": {
    "conversation_id": "8c59f0f9-a35c-41fb-992a-3023e3e29f8f",
    "sender_account_id": "acc_01h9w2m8g8qpr88v75v1w7jx8q",
    "sender_device_id": 1,
    "ciphertext": "opaquebase64ciphertextbytesherefromdoubleratchetpayload",
    "message_id": "msg_01h9w2m8g8qpr88v75v1w7jx8q"
  }
}
